{
  "artifacts": [
    {
      "frozen_at": "2026-09-25T22:39:37.074261+00:00",
      "frozen_by": "driver",
      "node": "understand",
      "path": "01_understand/tests.json",
      "sha256": "c0dacc9d2ad4ea20689827013da2e6df6f895122865c30e1565250536bae7b23"
    },
    {
      "frozen_at": "2026-09-25T22:39:37.074261+00:00",
      "frozen_by": "driver",
      "node": "understand",
      "path": "01_understand/Problem.md",
      "sha256": "01d6dc9ab6e3e8a9d64285a9ecb585afc9542727c7e522ec26de16bd2c4d6a7a"
    },
    {
      "frozen_at": "2026-09-25T22:39:37.219920+00:00",
      "frozen_by": "driver",
      "node": "decide",
      "path": "02_decide/mapping.json",
      "sha256": "928c35a2bd9efade0470f0db48e5d2ea4de91f628d12e024c88d9bf271e59364"
    },
    {
      "frozen_at": "2026-09-25T22:39:37.219920+00:00",
      "frozen_by": "driver",
      "node": "decide",
      "path": "02_decide/Deferred.md",
      "sha256": "3b3d661176dacbee8c545200b47a6e46ed2f9a90f080942ecfa2cbcd776dbaba"
    },
    {
      "frozen_at": "2026-09-25T22:39:37.219920+00:00",
      "frozen_by": "driver",
      "node": "decide",
      "path": "02_decide/principles.json",
      "sha256": "5e225f8574ad0f4b7118c1ed70ec37dc690ea3e4bf3a78fa1547971737fec129"
    },
    {
      "frozen_at": "2026-09-25T22:39:37.219920+00:00",
      "frozen_by": "driver",
      "node": "decide",
      "path": "02_decide/Decision.md",
      "sha256": "c5c7e23cf177e4e440f639e55a7c42006379dd4f771895215436ee123686f33e"
    },
    {
      "frozen_at": "2026-09-25T22:39:37.360494+00:00",
      "frozen_by": "driver",
      "node": "draft",
      "path": "03_draft/workplan.json",
      "sha256": "568b3af288c55111889266717876bb75097afcc2c42ee9b8831a221243a15412"
    },
    {
      "frozen_at": "2026-09-25T22:39:37.360494+00:00",
      "frozen_by": "driver",
      "node": "draft",
      "path": "03_draft/criteria/greeting-file.json",
      "sha256": "b75ed7ccfe3e14d9e0a56e9359d8fb628fce3681fd4e6bd038f98a7288a46371"
    },
    {
      "frozen_at": "2026-09-25T22:39:37.360494+00:00",
      "frozen_by": "driver",
      "node": "draft",
      "path": "03_draft/criteria/greet-command.json",
      "sha256": "e5fbc22493316e8844978db766218633e67ac6fe9fcbbfee97eff4b16c0ef1a9"
    },
    {
      "frozen_at": "2026-09-25T22:39:37.360494+00:00",
      "frozen_by": "driver",
      "node": "draft",
      "path": "03_draft/PRD.md",
      "sha256": "621f91508086b9b796699b243e9e7be899248bee57a946b1e17fc8c234526b74"
    },
    {
      "frozen_at": "2026-09-25T22:39:37.645823+00:00",
      "frozen_by": "driver",
      "node": "build",
      "path": "RECONCILIATION.md",
      "sha256": "b34a40085d2835fd1db0a4d5841f031d1a5cf930e1efb0c3b4fdba294a138537"
    }
  ],
  "budget": {
    "doubled_back_events": [],
    "doubled_back_rounds": 0
  },
  "current_node": "build",
  "descope_decision_ref": null,
  "driver": {
    "authority": null,
    "human_present": false,
    "tier": null
  },
  "escape_rate": null,
  "final_route": null,
  "gates": [
    {
      "node": "understand",
      "passed": true,
      "passed_at": "2026-09-25T22:39:37.074430+00:00"
    },
    {
      "node": "decide",
      "passed": true,
      "passed_at": "2026-09-25T22:39:37.220181+00:00"
    },
    {
      "node": "draft",
      "passed": true,
      "passed_at": "2026-09-25T22:39:37.360832+00:00"
    },
    {
      "node": "build",
      "passed": true,
      "passed_at": "2026-09-25T22:39:37.645913+00:00"
    }
  ],
  "goal_slug": "toy-run",
  "input_hash": "d9281a4fbae9231123cc5526c76e7fd157946386f07aeda31228716a59ffbf34",
  "kill": {
    "fired": false,
    "reason": null
  },
  "original_input": "Add a greeting to the project: a greeting.txt file holding the line \"Hello, world\", and a greet.py command that prints whatever greeting.txt says.\n",
  "run_id": "77fe31ae-062e-4816-8add-1e6e44fd6c75",
  "status": "live",
  "trail": [
    {
      "entered_at": "2026-09-25T22:39:36.888820+00:00",
      "exited_at": "2026-09-25T22:39:36.981315+00:00",
      "node": "framing"
    },
    {
      "entered_at": "2026-09-25T22:39:36.981315+00:00",
      "exited_at": "2026-09-25T22:39:37.125158+00:00",
      "node": "understand"
    },
    {
      "entered_at": "2026-09-25T22:39:37.125158+00:00",
      "exited_at": "2026-09-25T22:39:37.266148+00:00",
      "node": "decide"
    },
    {
      "entered_at": "2026-09-25T22:39:37.266148+00:00",
      "exited_at": "2026-09-25T22:39:37.408688+00:00",
      "node": "draft"
    },
    {
      "entered_at": "2026-09-25T22:39:37.408688+00:00",
      "exited_at": null,
      "node": "build"
    }
  ]
}
